10:20:00.000020 IP 244.131.189.196.22379 > 245.184.172.199.80: tcp 0
10:20:00.000020 IP 244.131.189.196.22379 > 45.184.172.199.80: tcp 10
10:20:00.000033 IP 140.136.248.230.80 > 10.140.88.183.40732: tcp 30
10:20:00.000065 IP 227.139.51.168.80 > 15.155.159.194.2568: tcp 120
10:20:00.000065 IP 227.139.51.168.80 > 1.155.159.194.2568: tcp 450
10:20:00.000065 IP 227.139.51.168.80 > 11.155.159.194.2568: tcp 300
10:20:00.000028 IP 0.121.193.213.80 > 4.107.103.69.2020: tcp 1460
10:20:00.000033 IP 140.136.248.230.80 > 100.140.88.183.40732: tcp 0
10:20:00.000033 IP 140.137.3.103.5662 > 237.118.29.232.1409: tcp 0
10:20:00.000033 IP 3.193.118.54.1657 > 236.230.104.55.6699: tcp 537
10:20:00.000048 IP 227.64.161.155.80 > 237.83.213.217.2440: tcp 0
10:20:00.000050 IP 3.3.239.91.11092 > 3.112.98.34.24886: tcp 1448
10:20:00.000055 IP 140.136.248.230.3617 > 3.82.176.112.21: tcp 0
10:20:00.000058 IP 0.180.247.23.4335 > 237.221.28.44.6699: tcp 536
10:20:00.000065 IP 227.139.51.168.80 > 115.155.159.194.2568: tcp 1460
10:20:00.000033 IP 140.137.3.103.5662 > 237.118.29.23.1409: tcp 0
10:20:00.000033 IP 140.137.3.103.5662 > 237.11.29.232.1409: tcp 0
10:20:00.000033 IP 140.137.3.103.5662 > 37.118.29.232.1409: tcp 0
10:20:00.000033 IP 140.137.3.103.5662 > 237.118.29.32.1409: tcp 0
10:20:00.000033 IP 140.137.3.103.5662 > 237.118.29.32.1409: tcp 0
